{
  "id": "epiphanias-2",
  "name": "2. Sonntag nach Epiphanias",
  "season": "epiphanias",
  "color": "green",
  "rank": "sonntag",
  "lang": "de",
  "readings": {
    "gospel": {
      "ref": "Joh 2,1-11",
      "stable": true,
      "text": "Und am dritten Tag ward eine Hochzeit zu Kana in Galiläa; und die Mutter Jesu war da. Jesus aber und seine Jünger wurden auch auf die Hochzeit geladen. Und da es an Wein gebrach, spricht die Mutter Jesu zu ihm: Sie haben nicht Wein. Jesus spricht zu ihr: Weib, was habe ich mit dir zu schaffen? Meine Stunde ist noch nicht gekommen. Seine Mutter spricht zu den Dienern: Was er euch sagt, das tut. Es waren aber allda sechs steinerne Wasserkrüge gesetzt nach der Weise der jüdischen Reinigung, und ging in je einen zwei oder drei Maß. Jesus spricht zu ihnen: Füllet die Wasserkrüge mit Wasser! Und sie füllten sie bis obenan. Und er spricht zu ihnen: Schöpfet nun und bringet's dem Speisemeister! Und sie brachten's. Als aber der Speisemeister kostete den Wein, der Wasser gewesen war, und wußte nicht, woher er kam (die Diener aber wußten's, die das Wasser geschöpft hatten), ruft der Speisemeister den Bräutigam und spricht zu ihm: Jedermann gibt zum ersten guten Wein, und wenn sie trunken geworden sind, alsdann den geringeren; du hast den guten Wein bisher behalten. Das ist das erste Zeichen, das Jesus tat, geschehen zu Kana in Galiläa, und offenbarte seine Herrlichkeit. Und seine Jünger glaubten an ihn.",
      "source": "Lutherbibel 1912",
      "license": "public-domain",
      "public_domain": true
    },
    "epistle": {
      "ref": "Röm 12,6-16",
      "text": "und haben mancherlei Gaben nach der Gnade, die uns gegeben ist. Hat jemand Weissagung, so sei sie dem Glauben gemäß. Hat jemand ein Amt, so warte er des Amts. Lehrt jemand, so warte er der Lehre. Ermahnt jemand, so warte er des Ermahnens. Gibt jemand, so gebe er einfältig. Regiert jemand, so sei er sorgfältig. Übt jemand Barmherzigkeit, so tue er's mit Lust. Die Liebe sei nicht falsch. Hasset das Arge, hanget dem Guten an. Die brüderliche Liebe untereinander sei herzlich. Einer komme dem andern mit Ehrerbietung zuvor. Seid nicht träge in dem, was ihr tun sollt. Seid brünstig im Geiste. Schicket euch in die Zeit. Seid fröhlich in Hoffnung, geduldig in Trübsal, haltet an am Gebet. Nehmet euch der Notdurft der Heiligen an. Herberget gern. Segnet, die euch verfolgen; segnet und fluchet nicht. Freut euch mit den Fröhlichen und weint mit den Weinenden. Habt einerlei Sinn untereinander. Trachtet nicht nach hohen Dingen, sondern haltet euch herunter zu den Niedrigen.",
      "source": "Lutherbibel 1912",
      "license": "public-domain",
      "public_domain": true
    },
    "psalm": {
      "ref": "Ps 36",
      "text": "Ein Psalm Davids, des Knechtes des HERRN, vorzusingen. Es ist aus Grund meines Herzens von der Gottlosen Wesen gesprochen, daß keine Gottesfurcht bei ihnen ist. Sie schmücken sich untereinander selbst, daß sie ihre böse Sache fördern und andere verunglimpfem. Alle ihre Worte sind schädlich und erlogen; sie lassen sich auch nicht weisen, daß sie Gutes täten; sondern sie trachten auf ihrem Lager nach Schaden und stehen fest auf dem bösen Weg und scheuen kein Arges. HERR, deine Güte reicht, soweit der Himmel ist, und deine Wahrheit, soweit die Wolken gehen. Deine Gerechtigkeit steht wie die Berge Gottes und dein Recht wie eine große Tiefe. HERR, du hilfst Menschen und Vieh. Wie teuer ist deine Güte, Gott, daß Menschenkinder unter dem Schatten deiner Flügel Zuflucht haben! Sie werden trunken von den reichen Gütern deines Hauses, und du tränkest sie mit Wonne als mit einem Strom. Denn bei dir ist die Quelle des Lebens, und in deinem Licht sehen wir das Licht. Breite deine Güte über die, die dich kennen, und deine Gerechtigkeit über die Frommen. Laß mich nicht von den Stolzen untertreten werden, und die Hand der Gottlosen stürze mich nicht; sondern laß sie, die Übeltäter, daselbst fallen, daß sie verstoßen werden und nicht bleiben mögen.",
      "source": "Lutherbibel 1912",
      "license": "public-domain",
      "public_domain": true
    }
  }
}
