{
  "id": "trinitatis-16",
  "name": "16. Sonntag nach Trinitatis",
  "season": "trinitatis",
  "color": "green",
  "rank": "sonntag",
  "lang": "de",
  "readings": {
    "gospel": {
      "ref": "Lk 7,11-17",
      "stable": true,
      "text": "Und es begab sich darnach, daß er in eine Stadt mit Namen Nain ging; und seiner Jünger gingen viele mit ihm und viel Volks. Als er aber nahe an das Stadttor kam, siehe, da trug man einen Toten heraus, der ein einziger Sohn war seiner Mutter, und sie war eine Witwe; und viel Volks aus der Stadt ging mit ihr. Und da sie der HERR sah, jammerte ihn derselben, und er sprach zu ihr: Weine nicht! Und er trat hinzu und rührte den Sarg an; und die Träger standen. Und er sprach: Jüngling, ich sage dir, stehe auf! Und der Tote richtete sich auf und fing an zu reden; und er gab ihn seiner Mutter. Und es kam sie alle eine Furcht an und sie priesen Gott und sprachen: Es ist ein großer Prophet unter uns aufgestanden, und Gott hat sein Volk heimgesucht. Und diese Rede von ihm erscholl in das ganze jüdische Land und in alle umliegenden Länder.",
      "source": "Lutherbibel 1912",
      "license": "public-domain",
      "public_domain": true
    },
    "epistle": {
      "ref": "Eph 3,13-21",
      "text": "Darum bitte ich, daß ihr nicht müde werdet um meiner Trübsal willen, die ich für euch leide, welche euch eine Ehre sind. Derhalben beuge ich meine Kniee vor dem Vater unsers HERRN Jesu Christi, der der rechte Vater ist über alles, was da Kinder heißt im Himmel und auf Erden, daß er euch Kraft gebe nach dem Reichtum seiner Herrlichkeit, stark zu werden durch seinen Geist an dem inwendigen Menschen, daß Christus wohne durch den Glauben in euren Herzen und ihr durch die Liebe eingewurzelt und gegründet werdet, auf daß ihr begreifen möget mit allen Heiligen, welches da sei die Breite und die Länge und die Tiefe und die Höhe; auch erkennen die Liebe Christi, die doch alle Erkenntnis übertrifft, auf daß ihr erfüllt werdet mit allerlei Gottesfülle. Dem aber, der überschwenglich tun kann über alles, das wir bitten oder verstehen, nach der Kraft, die da in uns wirkt, dem sei Ehre in der Gemeinde, die in Christo Jesu ist, zu aller Zeit, von Ewigkeit zu Ewigkeit! Amen.",
      "source": "Lutherbibel 1912",
      "license": "public-domain",
      "public_domain": true
    },
    "psalm": {
      "ref": "Ps 68",
      "text": "Ein Psalmlied Davids, vorzusingen. Es stehe Gott auf, daß seine Feinde zerstreut werden, und die ihn hassen, vor ihm fliehen. Vertreibe sie, wie der Rauch vertrieben wird; wie das Wachs zerschmilzt vom Feuer, so müssen umkommen die Gottlosen vor Gott. Die Gerechten aber müssen sich freuen und fröhlich sein vor Gott und von Herzen sich freuen. Singet Gott, lobsinget seinem Namen! Machet Bahn dem, der durch die Wüste herfährt - er heißt HERR -, und freuet euch vor ihm, der ein Vater ist der Waisen und ein Richter der Witwen. Er ist Gott in seiner heiligen Wohnung, ein Gott, der den Einsamen das Haus voll Kinder gibt, der die Gefangenen ausführt zu rechter Zeit und läßt die Abtrünnigen bleiben in der Dürre. Gott, da du vor deinem Volk her zogst, da du einhergingst in der Wüste (Sela), da bebte die Erde, und die Himmel troffen vor Gott, dieser Sinai vor dem Gott, der Israels Gott ist. Du gabst, Gott, einen gnädigen Regen; und dein Erbe, das dürre war, erquicktest du, daß deine Herde darin wohnen könne. Gott, du labtest die Elenden mit deinen Gütern. Der HERR gab das Wort mit großen Scharen Evangelisten: \"Die Könige der Heerscharen flohen eilends, und die Hausehre teilte den Raub aus. Wenn ihr zwischen den Hürden laget, so glänzte es wie der Taube Flügel, die wie Silber und Gold schimmern. Als der Allmächtige die Könige im Lande zerstreute, da ward es helle, wo es dunkel war.\" Ein Gebirge Gottes ist das Gebirge Basans; ein großes Gebirge ist das Gebirge Basans. Was seht ihr scheel, ihr großen Gebirge, auf den Berg, da Gott Lust hat zu wohnen? Und der HERR bleibt auch immer daselbst. Der Wagen Gottes sind vieltausendmal tausend; der HERR ist unter ihnen am heiligen Sinai. Du bist in die Höhe gefahren und hast das Gefängnis gefangen; du hast Gaben empfangen für die Menschen, auch die Abtrünnigen, auf daß Gott der HERR daselbst wohne. Gelobet sei der HERR täglich. Gott legt uns eine Last auf; aber er hilft uns auch. (Sela.) Wir haben einen Gott, der da hilft, und den Herrn HERRN, der vom Tode errettet. Ja, Gott wird den Kopf seiner Feinde zerschmettern, den Haarschädel derer, die da fortfahren in ihrer Sünde. Der HERR hat gesagt: \"Aus Basan will ich dich wieder holen, aus der Tiefe des Meeres will ich sie holen, daß dein Fuß in der Feinde Blut gefärbt werde und deine Hunde es lecken.\" Man sieht, Gott, wie du einherziehst, wie du, mein Gott und König, einherziehst im Heiligtum. Die Sänger gehen vorher, die Spielleute unter den Jungfrauen, die da pauken: \"Lobet Gott den HERRN in den Versammlungen, ihr vom Brunnen Israels!\" Da herrscht unter ihnen der kleine Benjamin, die Fürsten Juda's mit ihren Haufen, die Fürsten Sebulons, die Fürsten Naphthalis. Dein Gott hat dein Reich aufgerichtet; das wollest du, Gott, uns stärken, denn es ist dein Werk. Um deines Tempels willen zu Jerusalem werden dir die Könige Geschenke zuführen. Schilt das Tier im Rohr, die Rotte der Ochsen mit ihren Kälbern, den Völkern, die da zertreten um Geldes willen. Er zerstreut die Völker, die da gerne kriegen. Die Fürsten aus Ägypten werden kommen; Mohrenland wird seine Hände ausstrecken zu Gott. Ihr Königreiche auf Erden, singet Gott, lobsinget dem HERRN (Sela), dem, der da fährt im Himmel allenthalben von Anbeginn! Siehe, er wird seinem Donner Kraft geben. Gebet Gott die Macht! Seine Herrlichkeit ist über Israel, und seine Macht in den Wolken. Gott ist wundersam in seinem Heiligtum. Er ist Gott Israels; er wird dem Volk Macht und Kraft geben. Gelobt sei Gott!",
      "source": "Lutherbibel 1912",
      "license": "public-domain",
      "public_domain": true
    }
  }
}
