{
  "id": "septuagesimae",
  "name": "Septuagesimae",
  "season": "vorfasten",
  "color": "green",
  "rank": "sonntag",
  "lang": "de",
  "readings": {
    "gospel": {
      "ref": "Matt 20,1-16",
      "stable": true,
      "text": "Das Himmelreich ist gleich einem Hausvater, der am Morgen ausging, Arbeiter zu mieten in seinen Weinberg. Und da er mit den Arbeitern eins ward um einen Groschen zum Tagelohn, sandte er sie in seinen Weinberg. Und ging aus um die dritte Stunde und sah andere an dem Markte müßig stehen und sprach zu ihnen: Gehet ihr auch hin in den Weinberg; ich will euch geben, was recht ist. Und sie gingen hin. Abermals ging er aus um die sechste und die neunte Stunde und tat gleichalso. Um die elfte Stunde aber ging er aus und fand andere müßig stehen und sprach zu ihnen: Was steht ihr hier den ganzen Tag müßig? Sie sprachen zu ihm: Es hat uns niemand gedingt. Er sprach zu ihnen: Gehet ihr auch hin in den Weinberg, und was recht sein wird, soll euch werden. Da es nun Abend ward, sprach der Herr des Weinberges zu seinem Schaffner: Rufe die Arbeiter und gib ihnen den Lohn und heb an an den Letzten bis zu den Ersten. Da kamen, die um die elfte Stunde gedingt waren, und empfing ein jeglicher seinen Groschen. Da aber die ersten kamen, meinten sie, sie würden mehr empfangen; und sie empfingen auch ein jeglicher seinen Groschen. Und da sie den empfingen, murrten sie wider den Hausvater und sprachen: Diese haben nur eine Stunde gearbeitet, und du hast sie uns gleich gemacht, die wir des Tages Last und die Hitze getragen haben. Er antwortete aber und sagte zu einem unter ihnen: Mein Freund, ich tue dir nicht Unrecht. Bist du nicht mit mir eins geworden für einen Groschen? Nimm, was dein ist, und gehe hin! Ich will aber diesem letzten geben gleich wie dir. Oder habe ich nicht Macht, zu tun, was ich will, mit dem Meinen? Siehst du darum so scheel, daß ich so gütig bin? Also werden die Letzten die Ersten und die Ersten die Letzten sein. Denn viele sind berufen, aber wenige auserwählt.",
      "source": "Lutherbibel 1912",
      "license": "public-domain",
      "public_domain": true
    },
    "epistle": {
      "ref": "1Kor 9,24-27",
      "_note": "Orig.: 1Kor 9,24–10,5 — kapitelübergreifend, gekürzt",
      "text": "Wisset ihr nicht, daß die, so in den Schranken laufen, die laufen alle, aber einer erlangt das Kleinod? Laufet nun also, daß ihr es ergreifet! Ein jeglicher aber, der da kämpft, enthält sich alles Dinges; jene also, daß sie eine vergängliche Krone empfangen, wir aber eine unvergängliche. Ich laufe aber also, nicht als aufs Ungewisse; ich fechte also, nicht als der in die Luft streicht; sondern ich betäube meinen Leib und zähme ihn, daß ich nicht den andern predige, und selbst verwerflich werde.",
      "source": "Lutherbibel 1912",
      "license": "public-domain",
      "public_domain": true
    },
    "psalm": {
      "ref": "Ps 31",
      "text": "Ein Psalm Davids, vorzusingen. HERR, auf dich traue ich, laß mich nimmermehr zu Schanden werden; errette mich durch deine Gerechtigkeit! Neige deine Ohren zu mir, eilend hilf mir! Sei mir ein starker Fels und eine Burg, daß du mir helfest! Denn du bist mein Fels und meine Burg, und um deines Namens willen wolltest du mich leiten und führen. Du wollest mich aus dem Netze ziehen, das sie mir gestellt haben; denn du bist meine Stärke. In deine Hände befehle ich meinen Geist; du hast mich erlöst, HERR, du treuer Gott. Ich hasse, die da halten auf eitle Götzen; ich aber hoffe auf den HERRN. Ich freue mich und bin fröhlich über deine Güte, daß du mein Elend ansiehst und erkennst meine Seele in der Not und übergibst mich nicht in die Hände des Feindes; du stellst meine Füße auf weiten Raum. HERR, sei mir gnädig, denn mir ist angst; meine Gestalt ist verfallen vor Trauern, dazu meine Seele und mein Leib. Denn mein Leben hat abgenommen vor Betrübnis und meine Zeit vor Seufzen; meine Kraft ist verfallen vor meiner Missetat, und meine Gebeine sind verschmachtet. Es geht mir so übel, daß ich bin eine große Schmach geworden meinen Nachbarn und eine Scheu meinen Verwandten; die mich sehen auf der Gasse, fliehen vor mir. Mein ist vergessen im Herzen wie eines Toten; ich bin geworden wie ein zerbrochenes Gefäß. Denn ich höre, wie mich viele schelten, Schrecken ist um und um; sie ratschlagen miteinander über mich und denken, mir das Leben zu nehmen. Ich aber, HERR, hoffe auf dich und spreche: Du bist mein Gott! Meine Zeit steht in deinen Händen. Errette mich von der Hand meiner Feinde und von denen, die mich verfolgen. Laß leuchten dein Antlitz über deinen Knecht; hilf mir durch deine Güte! HERR, laß mich nicht zu Schanden werden; denn ich rufe dich an. Die Gottlosen müssen zu Schanden werden und schweigen in der Hölle. Verstummen müssen falsche Mäuler, die da reden gegen den Gerechten frech, stolz und höhnisch. Wie groß ist deine Güte, die du verborgen hast für die, so dich fürchten, und erzeigest vor den Leuten denen, die auf dich trauen! Du verbirgst sie heimlich bei dir vor jedermanns Trotz; du verdeckst sie in der Hütte vor den zänkischen Zungen. Gelobt sei der HERR, daß er hat eine wunderbare Güte mir bewiesen in einer festen Stadt. Denn ich sprach zu meinem Zagen: Ich bin von deinen Augen verstoßen. Dennoch hörtest du meines Flehens Stimme, da ich zu dir schrie. Liebet den HERRN, alle seine Heiligen! Die Gläubigen behütet der HERR und vergilt reichlich dem, der Hochmut übt. Seid getrost und unverzagt, alle, die ihr des HERRN harret!",
      "source": "Lutherbibel 1912",
      "license": "public-domain",
      "public_domain": true
    }
  }
}
