{
  "id": "trinitatis-17",
  "name": "17. Sonntag nach Trinitatis",
  "season": "trinitatis",
  "color": "green",
  "rank": "sonntag",
  "lang": "de",
  "readings": {
    "gospel": {
      "ref": "Lk 14,1-11",
      "stable": true,
      "text": "Und es begab sich, daß er kam in ein Haus eines Obersten der Pharisäer an einem Sabbat, das Brot zu essen; und sie hatten acht auf ihn. Und siehe, da war ein Mensch vor ihm, der war wassersüchtig. Und Jesus antwortete und sagte zu den Schriftgelehrten und Pharisäern und sprach: Ist's auch recht, am Sabbat zu heilen? Sie aber schwiegen still. Und er griff ihn an und heilte ihn und ließ ihn gehen. Und antwortete und sprach zu ihnen: Welcher ist unter euch, dem sein Ochse oder Esel in den Brunnen fällt, und der nicht alsbald ihn herauszieht am Sabbattage? Und sie konnten ihm darauf nicht wieder Antwort geben. Er sagte aber ein Gleichnis zu den Gästen, da er merkte, wie sie erwählten obenan zu sitzen, und sprach zu ihnen: Wenn du von jemand geladen wirst zur Hochzeit, so setze dich nicht obenan, daß nicht etwa ein Vornehmerer denn du von ihm geladen sei, und dann komme, der dich und ihn geladen hat, und spreche zu dir: Weiche diesem! und du müssest dann mit Scham untenan sitzen. Sondern wenn du geladen wirst, so gehe hin und setze dich untenan, auf daß, wenn da kommt, der dich geladen hat, er spreche zu dir: Freund, rücke hinauf! Dann wirst du Ehre haben vor denen, die mit dir am Tische sitzen. Denn wer sich selbst erhöht, der soll erniedrigt werden; und wer sich selbst erniedrigt, der soll erhöht werden.",
      "source": "Lutherbibel 1912",
      "license": "public-domain",
      "public_domain": true
    },
    "epistle": {
      "ref": "Eph 4,1-6",
      "text": "So ermahne nun euch ich Gefangener in dem HERRN, daß ihr wandelt, wie sich's gebührt eurer Berufung, mit der ihr berufen seid, mit aller Demut und Sanftmut, mit Geduld, und vertraget einer den andern in der Liebe und seid fleißig, zu halten die Einigkeit im Geist durch das Band des Friedens: ein Leib und ein Geist, wie ihr auch berufen seid auf einerlei Hoffnung eurer Berufung; ein HERR, ein Glaube, eine Taufe; ein Gott und Vater unser aller, der da ist über euch allen und durch euch alle und in euch allen.",
      "source": "Lutherbibel 1912",
      "license": "public-domain",
      "public_domain": true
    },
    "psalm": {
      "ref": "Ps 25",
      "text": "Ein Psalm Davids. Nach dir, HERR, verlangt mich. Mein Gott, ich hoffe auf dich; laß mich nicht zu Schanden werden, daß sich meine Feinde nicht freuen über mich. Denn keiner wird zu Schanden, der dein harret; aber zu Schanden müssen sie werden, die leichtfertigen Verächter. HERR, zeige mir deine Wege und lehre mich deine Steige; leite mich in deiner Wahrheit und lehre mich! Denn du bist der Gott, der mir hilft; täglich harre ich dein. Gedenke, HERR, an deine Barmherzigkeit und an deine Güte, die von der Welt her gewesen ist. Gedenke nicht der Sünden meiner Jugend und meiner Übertretungen; gedenke aber mein nach deiner Barmherzigkeit um deiner Güte willen! Der HERR ist gut und fromm; darum unterweist er die Sünder auf dem Wege. Er leitet die Elenden recht und lehrt die Elenden seinen Weg. Die Wege des HERRN sind eitel Güte und Wahrheit denen, die seinen Bund und seine Zeugnisse halten. Um deines Namens willen, HERR, sei gnädig meiner Missetat, die da groß ist. Wer ist der, der den HERRN fürchtet? Er wird ihn unterweisen den besten Weg. Seine Seele wird im Guten wohnen, und sein Same wird das Land besitzen. Das Geheimnis des HERRN ist unter denen, die ihn fürchten; und seinen Bund läßt er sie wissen. Meine Augen sehen stets zu dem HERRN; denn er wird meinen Fuß aus dem Netze ziehen. Wende dich zu mir und sei mir gnädig; denn ich bin einsam und elend. Die Angst meines Herzens ist groß; führe mich aus meinen Nöten! Siehe an meinen Jammer und mein Elend und vergib mir alle meine Sünden! Siehe, daß meiner Feinde so viel sind und hassen mich aus Frevel. Bewahre meine Seele und errette mich, laß mich nicht zu Schanden werden; denn ich traue auf dich. Schlecht und Recht, das behüte mich; denn ich harre dein. Gott, erlöse Israel aus aller seiner Not!",
      "source": "Lutherbibel 1912",
      "license": "public-domain",
      "public_domain": true
    }
  }
}
