{
  "id": "cantate",
  "name": "Cantate",
  "season": "ostern",
  "color": "white",
  "rank": "sonntag",
  "lang": "de",
  "readings": {
    "gospel": {
      "ref": "Joh 16,5-15",
      "stable": true,
      "text": "Nun aber gehe ich hin zu dem, der mich gesandt hat; und niemand unter euch fragt mich: Wo gehst du hin? Sondern weil ich solches geredet habe, ist euer Herz voll Trauerns geworden. Aber ich sage euch die Wahrheit: es ist euch gut, daß ich hingehe. Denn so ich nicht hingehe, so kommt der Tröster nicht zu euch; so ich aber gehe, will ich ihn zu euch senden. Und wenn derselbe kommt, wird er die Welt strafen um die Sünde und um die Gerechtigkeit und um das Gericht: um die Sünde, daß sie nicht glauben an mich; um die Gerechtigkeit aber, daß ich zum Vater gehe und ihr mich hinfort nicht sehet; um das Gericht, daß der Fürst dieser Welt gerichtet ist. Ich habe euch noch viel zu sagen; aber ihr könnt es jetzt nicht tragen. Wenn aber jener, der Geist der Wahrheit, kommen wird, der wird euch in alle Wahrheit leiten. Denn er wird nicht von sich selber reden; sondern was er hören wird, das wird er reden, und was zukünftig ist, wird er euch verkünden. Derselbe wird mich verklären; denn von dem Meinen wird er's nehmen und euch verkündigen. Alles, was der Vater hat, das ist mein. Darum habe ich euch gesagt: Er wird's von dem Meinen nehmen und euch verkündigen.",
      "source": "Lutherbibel 1912",
      "license": "public-domain",
      "public_domain": true
    },
    "epistle": {
      "ref": "Jak 1,16-21",
      "text": "Irret nicht, liebe Brüder. Alle gute Gabe und alle vollkommene Gabe kommt von obenherab, von dem Vater des Lichts, bei welchem ist keine Veränderung noch Wechsel des Lichtes und der Finsternis. Er hat uns gezeugt nach seinem Willen durch das Wort der Wahrheit, auf daß wir wären Erstlinge seiner Kreaturen. Darum, liebe Brüder, ein jeglicher Mensch sei schnell, zu hören, langsam aber, zu reden, und langsam zum Zorn. Denn des Menschen Zorn tut nicht, was vor Gott recht ist. Darum so leget ab alle Unsauberkeit und alle Bosheit und nehmet das Wort an mit Sanftmut, das in euch gepflanzt ist, welches kann eure Seelen selig machen.",
      "source": "Lutherbibel 1912",
      "license": "public-domain",
      "public_domain": true
    },
    "psalm": {
      "ref": "Ps 98",
      "text": "Ein Psalm. Singet dem HERRN ein neues Lied; denn er tut Wunder. Er siegt mit seiner Rechten und mit seinem heiligen Arm. Der HERR läßt sein Heil verkündigen; vor den Völkern läßt er seine Gerechtigkeit offenbaren. Er gedenkt an seine Gnade und Wahrheit dem Hause Israel; aller Welt Enden sehen das Heil unsers Gottes. Jauchzet dem HERRN, alle Welt; singet, rühmet und lobet! Lobet den HERRN mit Harfen, mit Harfen und Psalmen! Mit Drommeten und Posaunen jauchzet vor dem HERRN, dem König! Das Meer brause und was darinnen ist, der Erdboden und die darauf wohnen. Die Wasserströme frohlocken, und alle Berge seien fröhlich vor dem HERRN; denn er kommt das Erdreich zu richten. Er wird den Erdboden richten mit Gerechtigkeit und die Völker mit Recht.",
      "source": "Lutherbibel 1912",
      "license": "public-domain",
      "public_domain": true
    }
  }
}
