{
  "id": "trinitatis-22",
  "name": "22. Sonntag nach Trinitatis",
  "season": "trinitatis",
  "color": "green",
  "rank": "sonntag",
  "lang": "de",
  "readings": {
    "gospel": {
      "ref": "Matt 18,23-35",
      "stable": true,
      "text": "Darum ist das Himmelreich gleich einem König, der mit seinen Knechten rechnen wollte. Und als er anfing zu rechnen, kam ihm einer vor, der war ihm zehntausend Pfund schuldig. Da er's nun nicht hatte, zu bezahlen, hieß der Herr verkaufen ihn und sein Weib und seine Kinder und alles, was er hatte, und bezahlen. Da fiel der Knecht nieder und betete ihn an und sprach: Herr, habe Geduld mit mir, ich will dir's alles bezahlen. Da jammerte den Herrn des Knechtes, und er ließ ihn los, und die Schuld erließ er ihm auch. Da ging derselbe Knecht hinaus und fand einen seiner Mitknechte, der war ihm hundert Groschen schuldig; und er griff ihn an und würgte ihn und sprach: Bezahle mir, was du mir schuldig bist! Da fiel sein Mitknecht nieder und bat ihn und sprach: Habe Geduld mit mir; ich will dir's alles bezahlen. Er wollte aber nicht, sondern ging hin und warf ihn ins Gefängnis, bis daß er bezahlte, was er schuldig war. Da aber seine Mitknechte solches sahen, wurden sie sehr betrübt und kamen und brachten vor ihren Herrn alles, was sich begeben hatte. Da forderte ihn sein Herr vor sich und sprach zu ihm: Du Schalksknecht, alle diese Schuld habe ich dir erlassen, dieweil du mich batest; solltest du denn dich nicht auch erbarmen über deinen Mitknecht, wie ich mich über dich erbarmt habe? Und sein Herr ward sehr zornig und überantwortete ihn den Peinigern, bis daß er bezahlte alles, was er ihm schuldig war. Also wird euch mein himmlischer Vater auch tun, so ihr nicht vergebt von eurem Herzen, ein jeglicher seinem Bruder seine Fehler.",
      "source": "Lutherbibel 1912",
      "license": "public-domain",
      "public_domain": true
    },
    "epistle": {
      "ref": "Phil 1,3-11",
      "text": "Ich danke meinem Gott, so oft ich euer gedenke (welches ich allezeit tue in allem meinem Gebet für euch alle, und tue das Gebet mit Freuden), über eure Gemeinschaft am Evangelium vom ersten Tage an bis her, und bin desselben in guter Zuversicht, daß, der in euch angefangen hat das gute Werk, der wird's auch vollführen bis an den Tag Jesu Christi. Wie es denn mir billig ist, daß ich dermaßen von euch halte, darum daß ich euch in meinem Herzen habe in diesem meinem Gefängnis, darin ich das Evangelium verantworte und bekräftige, als die ihr alle mit mir der Gnade teilhaftig seid. Denn Gott ist mein Zeuge, wie mich nach euch allen verlangt von Herzensgrund in Jesu Christo. Und darum bete ich, daß eure Liebe je mehr und mehr reich werde in allerlei Erkenntnis und Erfahrung, daß ihr prüfen möget, was das Beste sei, auf daß ihr seid lauter und unanstößig auf den Tag Christi, erfüllt mit Früchten der Gerechtigkeit, die durch Jesum Christum geschehen in euch zur Ehre und Lobe Gottes.",
      "source": "Lutherbibel 1912",
      "license": "public-domain",
      "public_domain": true
    },
    "psalm": {
      "ref": "Ps 103",
      "text": "Ein Psalm Davids. Lobe den HERRN, meine Seele, und was in mir ist, seinen heiligen Namen! Lobe den HERRN, meine Seele, und vergiß nicht, was er dir Gutes getan hat: der dir alle deine Sünden vergibt und heilet alle deine Gebrechen, der dein Leben vom Verderben erlöst, der dich krönt mit Gnade und Barmherzigkeit, der deinen Mund fröhlich macht, und du wieder jung wirst wie ein Adler. Der HERR schafft Gerechtigkeit und Gericht allen, die Unrecht leiden. Er hat seine Wege Mose wissen lassen, die Kinder Israel sein Tun. Barmherzig und gnädig ist der HERR, geduldig und von großer Güte. Er wird nicht immer hadern noch ewiglich Zorn halten. Er handelt nicht mit uns nach unsern Sünden und vergilt uns nicht nach unsrer Missetat. Denn so hoch der Himmel über der Erde ist, läßt er seine Gnade walten über die, so ihn fürchten. So ferne der Morgen ist vom Abend, läßt er unsre Übertretungen von uns sein. Wie sich ein Vater über Kinder erbarmt, so erbarmt sich der HERR über die, so ihn fürchten. Denn er kennt, was für ein Gemächte wir sind; er gedenkt daran, daß wir Staub sind. Ein Mensch ist in seinem Leben wie Gras, er blüht wie eine Blume auf dem Feld; wenn der Wind darüber geht, so ist sie nimmer da, und ihre Stätte kennt sie nicht mehr. Die Gnade aber des HERRN währet von Ewigkeit zu Ewigkeit über die, so ihn fürchten, und seine Gerechtigkeit auf Kindeskind bei denen, die seinen Bund halten und gedenken an seine Gebote, daß sie darnach tun. Der HERR hat seinen Stuhl im Himmel bereitet, und sein Reich herrscht über alles. Lobet den HERRN, ihr seine Engel, ihr starken Helden, die ihr seine Befehle ausrichtet, daß man höre auf die Stimme seines Wortes! Lobet den HERRN, alle seine Heerscharen, seine Diener, die ihr seinen Willen tut! Lobet den HERRN, alle seine Werke, an allen Orten seiner Herrschaft! Lobe den HERRN, meine Seele!",
      "source": "Lutherbibel 1912",
      "license": "public-domain",
      "public_domain": true
    }
  }
}
