{
  "id": "pfingstmontag",
  "name": "Pfingstmontag",
  "season": "pfingsten",
  "color": "red",
  "rank": "fest",
  "lang": "de",
  "readings": {
    "gospel": {
      "ref": "Joh 3,16-21",
      "stable": true,
      "text": "Also hat Gott die Welt geliebt, daß er seinen eingeborenen Sohn gab, auf daß alle, die an ihn glauben, nicht verloren werden, sondern das ewige Leben haben. Denn Gott hat seinen Sohn nicht gesandt in die Welt, daß er die Welt richte, sondern daß die Welt durch ihn selig werde. Wer an ihn glaubt, der wird nicht gerichtet; wer aber nicht glaubt, der ist schon gerichtet, denn er glaubt nicht an den Namen des eingeborenen Sohnes Gottes. Das ist aber das Gericht, daß das Licht in die Welt gekommen ist, und die Menschen liebten die Finsternis mehr als das Licht; denn ihre Werke waren böse. Wer arges tut, der haßt das Licht und kommt nicht an das Licht, auf daß seine Werke nicht gestraft werden. Wer aber die Wahrheit tut, der kommt an das Licht, daß seine Werke offenbar werden; denn sie sind in Gott getan.",
      "source": "Lutherbibel 1912",
      "license": "public-domain",
      "public_domain": true
    },
    "epistle": {
      "ref": "Apg 10,42-48",
      "text": "Und hat uns geboten, zu predigen dem Volk und zu zeugen, daß er ist verordnet von Gott zum Richter der Lebendigen und der Toten. Von diesem zeugen alle Propheten, daß durch seinen Namen alle, die an ihn glauben, Vergebung der Sünden empfangen sollen. Da Petrus noch diese Worte redete, fiel der heilige Geist auf alle, die dem Wort zuhörten. Und die Gläubigen aus den Juden, die mit Petrus gekommen waren, entsetzten sich, daß auch auf die Heiden die Gabe des heiligen Geistes ausgegossen ward; denn sie hörten, daß sie mit Zungen redeten und Gott hoch priesen. Da antwortete Petrus: Mag auch jemand das Wasser wehren, daß diese nicht getauft werden, die den heiligen Geist empfangen haben gleichwie auch wir? Und befahl, sie zu taufen in dem Namen des HERRN. Da baten sie ihn, daß er etliche Tage dabliebe.",
      "source": "Lutherbibel 1912",
      "license": "public-domain",
      "public_domain": true
    },
    "psalm": {
      "ref": "Ps 68",
      "text": "Ein Psalmlied Davids, vorzusingen. Es stehe Gott auf, daß seine Feinde zerstreut werden, und die ihn hassen, vor ihm fliehen. Vertreibe sie, wie der Rauch vertrieben wird; wie das Wachs zerschmilzt vom Feuer, so müssen umkommen die Gottlosen vor Gott. Die Gerechten aber müssen sich freuen und fröhlich sein vor Gott und von Herzen sich freuen. Singet Gott, lobsinget seinem Namen! Machet Bahn dem, der durch die Wüste herfährt - er heißt HERR -, und freuet euch vor ihm, der ein Vater ist der Waisen und ein Richter der Witwen. Er ist Gott in seiner heiligen Wohnung, ein Gott, der den Einsamen das Haus voll Kinder gibt, der die Gefangenen ausführt zu rechter Zeit und läßt die Abtrünnigen bleiben in der Dürre. Gott, da du vor deinem Volk her zogst, da du einhergingst in der Wüste (Sela), da bebte die Erde, und die Himmel troffen vor Gott, dieser Sinai vor dem Gott, der Israels Gott ist. Du gabst, Gott, einen gnädigen Regen; und dein Erbe, das dürre war, erquicktest du, daß deine Herde darin wohnen könne. Gott, du labtest die Elenden mit deinen Gütern. Der HERR gab das Wort mit großen Scharen Evangelisten: \"Die Könige der Heerscharen flohen eilends, und die Hausehre teilte den Raub aus. Wenn ihr zwischen den Hürden laget, so glänzte es wie der Taube Flügel, die wie Silber und Gold schimmern. Als der Allmächtige die Könige im Lande zerstreute, da ward es helle, wo es dunkel war.\" Ein Gebirge Gottes ist das Gebirge Basans; ein großes Gebirge ist das Gebirge Basans. Was seht ihr scheel, ihr großen Gebirge, auf den Berg, da Gott Lust hat zu wohnen? Und der HERR bleibt auch immer daselbst. Der Wagen Gottes sind vieltausendmal tausend; der HERR ist unter ihnen am heiligen Sinai. Du bist in die Höhe gefahren und hast das Gefängnis gefangen; du hast Gaben empfangen für die Menschen, auch die Abtrünnigen, auf daß Gott der HERR daselbst wohne. Gelobet sei der HERR täglich. Gott legt uns eine Last auf; aber er hilft uns auch. (Sela.) Wir haben einen Gott, der da hilft, und den Herrn HERRN, der vom Tode errettet. Ja, Gott wird den Kopf seiner Feinde zerschmettern, den Haarschädel derer, die da fortfahren in ihrer Sünde. Der HERR hat gesagt: \"Aus Basan will ich dich wieder holen, aus der Tiefe des Meeres will ich sie holen, daß dein Fuß in der Feinde Blut gefärbt werde und deine Hunde es lecken.\" Man sieht, Gott, wie du einherziehst, wie du, mein Gott und König, einherziehst im Heiligtum. Die Sänger gehen vorher, die Spielleute unter den Jungfrauen, die da pauken: \"Lobet Gott den HERRN in den Versammlungen, ihr vom Brunnen Israels!\" Da herrscht unter ihnen der kleine Benjamin, die Fürsten Juda's mit ihren Haufen, die Fürsten Sebulons, die Fürsten Naphthalis. Dein Gott hat dein Reich aufgerichtet; das wollest du, Gott, uns stärken, denn es ist dein Werk. Um deines Tempels willen zu Jerusalem werden dir die Könige Geschenke zuführen. Schilt das Tier im Rohr, die Rotte der Ochsen mit ihren Kälbern, den Völkern, die da zertreten um Geldes willen. Er zerstreut die Völker, die da gerne kriegen. Die Fürsten aus Ägypten werden kommen; Mohrenland wird seine Hände ausstrecken zu Gott. Ihr Königreiche auf Erden, singet Gott, lobsinget dem HERRN (Sela), dem, der da fährt im Himmel allenthalben von Anbeginn! Siehe, er wird seinem Donner Kraft geben. Gebet Gott die Macht! Seine Herrlichkeit ist über Israel, und seine Macht in den Wolken. Gott ist wundersam in seinem Heiligtum. Er ist Gott Israels; er wird dem Volk Macht und Kraft geben. Gelobt sei Gott!",
      "source": "Lutherbibel 1912",
      "license": "public-domain",
      "public_domain": true
    }
  }
}
